{
  "blind_review_hash": "sha256:0b278c608ef8973584e451cb036f19566af028be8bd5b6c0a4fdac484f30341f",
  "blind_review_sidecar_hash": "sha256:97963f012ba8eee2d8f16a4aa7a3f803b100935d0c43d5f591a5ff37e9e8d08b",
  "created_at": "2026-07-12T18:00:00Z",
  "deterministic_validation": "PASS",
  "reasons": [],
  "result": "PASS",
  "schema_version": "1.1.0"
}
